{
  "$schema": "https://json-schema.org/draft/2020-12/schema",
  "$id": "https://agent-control-plane.local/schemas/acp-assignment.schema.json",
  "title": "ACP Assignment",
  "type": "object",
  "required": [
    "assignment_id",
    "task_id",
    "role",
    "instructions",
    "expected_outputs",
    "evidence_requirements",
    "status"
  ],
  "properties": {
    "assignment_id": { "type": "string", "minLength": 1 },
    "task_id": { "type": "string", "minLength": 1 },
    "agent_profile_id": { "type": "string" },
    "role": {
      "type": "string",
      "enum": [
        "coordinator",
        "implementer",
        "researcher",
        "reviewer",
        "tester",
        "archivist",
        "specialist"
      ]
    },
    "instructions": { "type": "string", "maxLength": 32000 },
    "expected_outputs": {
      "type": "array",
      "maxItems": 500,
      "items": { "type": "string", "maxLength": 8000 }
    },
    "evidence_requirements": {
      "type": "array",
      "maxItems": 500,
      "items": { "type": "string", "maxLength": 8000 }
    },
    "status": {
      "type": "string",
      "enum": [
        "pending",
        "in_progress",
        "blocked",
        "done",
        "failed",
        "cancelled"
      ]
    },
    "blocked_reason": { "type": "string", "maxLength": 8000 }
  },
  "additionalProperties": false
}
